dataset,pipeline,query_id,query_text,elapsed_sec,ndcg@5,mrr@5,recall@5,map@5,ndcg@10,mrr@10,recall@10,map@10,ndcg@20,mrr@20,recall@20,map@20,ndcg,mrr,recall,map
SciFact,BM25 + BGE-Reranker,528,Human T-lymphotropic virus type-I-associated myelopathy / tropical spastic paraparesis (HAM/TSP) patients produce Immunoglobulin G (IgG) antibodies which cross-react with an immunodominant epitope in Tax.,3.1121804579997843,1.0,1.0,1.0,1.0,1.0,1.0,1.0,1.0,1.0,1.0,1.0,1.0,1.0,1.0,1.0,1.0
SciFact,BM25 + BGE-Reranker,532,Hyperfibrinogenemia decreases rates of femoropopliteal bypass thrombosis.,3.1280081569993854,1.0,1.0,1.0,1.0,1.0,1.0,1.0,1.0,1.0,1.0,1.0,1.0,1.0,1.0,1.0,1.0
SciFact,BM25 + BGE-Reranker,533,Hyperfibrinogenemia increases rates of femoropopliteal bypass thrombosis.,3.108807984000123,1.0,1.0,1.0,1.0,1.0,1.0,1.0,1.0,1.0,1.0,1.0,1.0,1.0,1.0,1.0,1.0
SciFact,BM25 + BGE-Reranker,535,Hypertension is frequently observed in type 1 diabetes patients.,3.0784013159991446,0.0,0.0,0.0,0.0,0.0,0.0,0.0,0.0,0.0,0.0,0.0,0.0,0.0,0.0,0.0,0.0
SciFact,BM25 + BGE-Reranker,536,Hypocretin neurones induce panicprone state in rats.,3.0106730019997485,1.0,1.0,1.0,1.0,1.0,1.0,1.0,1.0,1.0,1.0,1.0,1.0,1.0,1.0,1.0,1.0
SciFact,BM25 + BGE-Reranker,539,Hypoglycemia increases the risk of dementia.,3.046773371999734,1.0,1.0,1.0,1.0,1.0,1.0,1.0,1.0,1.0,1.0,1.0,1.0,1.0,1.0,1.0,1.0
SciFact,BM25 + BGE-Reranker,540,Hypothalamic glutamate neurotransmission is crucial to energy balance.,3.15799171100025,0.0,0.0,0.0,0.0,0.20438239758848611,0.14285714285714285,0.5,0.07142857142857142,0.20438239758848611,0.14285714285714285,0.5,0.07142857142857142,0.20438239758848611,0.14285714285714285,0.5,0.07142857142857142
SciFact,BM25 + BGE-Reranker,544,IFIT1 restricts viral replication by sequestrating mis-capped viral RNAs.,3.008614764000413,0.0,0.0,0.0,0.0,0.0,0.0,0.0,0.0,0.23137821315975915,0.05263157894736842,1.0,0.05263157894736842,0.0,0.0,0.0,0.0
SciFact,BM25 + BGE-Reranker,549,IRG1 has antiviral effects against neurotropic viruses.,3.031582396999511,1.0,1.0,1.0,1.0,1.0,1.0,1.0,1.0,1.0,1.0,1.0,1.0,1.0,1.0,1.0,1.0
SciFact,BM25 + BGE-Reranker,551,ITAM phosphorylation prevents the transfer of the T cell receptor (TCR) signal from the echo-domain to the cytoplasmic tail of the T cell receptor (TCR).,3.0941675869999017,0.0,0.0,0.0,0.0,0.0,0.0,0.0,0.0,0.25,0.06666666666666667,1.0,0.06666666666666667,0.0,0.0,0.0,0.0
SciFact,BM25 + BGE-Reranker,552,IgA plasma cells that are specific for transglutaminase 2 accumulate in the duodenal mucosa on commencement of a gluten-free diet.,3.174348574999385,1.0,1.0,1.0,1.0,1.0,1.0,1.0,1.0,1.0,1.0,1.0,1.0,1.0,1.0,1.0,1.0
SciFact,BM25 + BGE-Reranker,554,Immune complex triggered cell death leads to extracellular release of neutrophil protein HMGB1.,3.1136198819995116,0.0,0.0,0.0,0.0,0.31546487678572877,0.125,1.0,0.125,0.31546487678572877,0.125,1.0,0.125,0.31546487678572877,0.125,1.0,0.125
SciFact,BM25 + BGE-Reranker,560,Immune responses result in the development of inflammatory Th17 cells and anti-inflammatory iTregs.,3.0529784959999233,0.0,0.0,0.0,0.0,0.0,0.0,0.0,0.0,0.0,0.0,0.0,0.0,0.0,0.0,0.0,0.0
SciFact,BM25 + BGE-Reranker,569,"In adult tissue, most T cells are memory T cells.",2.9567654209995453,1.0,1.0,1.0,1.0,1.0,1.0,1.0,1.0,1.0,1.0,1.0,1.0,1.0,1.0,1.0,1.0
SciFact,BM25 + BGE-Reranker,575,"In domesticated populations of Saccharomyces cerevisiae, whole chromosome aneuploidy is very uncommon.",2.9907824199999595,1.0,1.0,1.0,1.0,1.0,1.0,1.0,1.0,1.0,1.0,1.0,1.0,1.0,1.0,1.0,1.0
SciFact,BM25 + BGE-Reranker,577,"In mice, P. chabaudi parasites are able to proliferate faster early in infection when inoculated at lower numbers than when inoculated at high numbers.",3.231652502000543,0.0,0.0,0.0,0.0,0.0,0.0,0.0,0.0,0.0,0.0,0.0,0.0,0.0,0.0,0.0,0.0
SciFact,BM25 + BGE-Reranker,578,"In mouse models, the loss of CSF1R facilitates MOZ-TIF2-induced leuekmogenesis.",2.953467587999512,1.0,1.0,1.0,1.0,1.0,1.0,1.0,1.0,1.0,1.0,1.0,1.0,1.0,1.0,1.0,1.0
SciFact,BM25 + BGE-Reranker,587,"In transgenic mice harboring green florescent protein under the control of the Sox2 promoter, less than ten percent of the cells with green florescent colocalize with cell proliferation markers.",3.163690678000421,0.6309297535714575,0.5,1.0,0.5,0.6309297535714575,0.5,1.0,0.5,0.6309297535714575,0.5,1.0,0.5,0.6309297535714575,0.5,1.0,0.5
SciFact,BM25 + BGE-Reranker,589,"In young and middle-aged adults, current or remote uses of ADHD medications do not increase the risk of serious cardiovascular events.",3.1411145349993603,1.0,1.0,1.0,1.0,1.0,1.0,1.0,1.0,1.0,1.0,1.0,1.0,1.0,1.0,1.0,1.0
SciFact,BM25 + BGE-Reranker,593,Incidence of heart failure decreased by 10% in women since 1979.,3.19825764000052,1.0,1.0,1.0,1.0,1.0,1.0,1.0,1.0,1.0,1.0,1.0,1.0,1.0,1.0,1.0,1.0
SciFact,BM25 + BGE-Reranker,597,Incidence rates of cervical cancer have decreased.,3.1512096960004783,0.7653606369886217,1.0,0.6666666666666666,0.6666666666666666,0.9325210919548239,1.0,1.0,0.8333333333333334,0.9325210919548239,1.0,1.0,0.8333333333333334,0.9325210919548239,1.0,1.0,0.8333333333333334
SciFact,BM25 + BGE-Reranker,598,Incidence rates of cervical cancer have increased due to nationwide screening programs based primarily on cytology to detect uterine cervical cancer.,3.122998548000396,0.0,0.0,0.0,0.0,0.31546487678572877,0.125,1.0,0.125,0.31546487678572877,0.125,1.0,0.125,0.31546487678572877,0.125,1.0,0.125
SciFact,BM25 + BGE-Reranker,613,Increased microtubule acetylation repairs LRRK2 Roc-COR domain mutation induced locomotor deficits.,3.023008850000224,1.0,1.0,1.0,1.0,1.0,1.0,1.0,1.0,1.0,1.0,1.0,1.0,1.0,1.0,1.0,1.0
SciFact,BM25 + BGE-Reranker,619,Increased vessel density along with a reduction in fibrosis decreases the efficacy of chemotherapy treatments.,3.1560280700005023,0.0,0.0,0.0,0.0,0.0,0.0,0.0,0.0,0.16569576576522954,0.08333333333333333,0.5,0.041666666666666664,0.0,0.0,0.0,0.0
SciFact,BM25 + BGE-Reranker,623,Individuals with low serum vitamin D concentrations have increased risk of multiple sclerosis.,3.2359202669995284,0.38685280723454163,0.2,1.0,0.2,0.38685280723454163,0.2,1.0,0.2,0.38685280723454163,0.2,1.0,0.2,0.38685280723454163,0.2,1.0,0.2
SciFact,BM25 + BGE-Reranker,628,Infection of human T-cell lymphotropic virus type 1 is most frequent in individuals of African origin.,3.0677129429996057,1.0,1.0,1.0,1.0,1.0,1.0,1.0,1.0,1.0,1.0,1.0,1.0,1.0,1.0,1.0,1.0
SciFact,BM25 + BGE-Reranker,636,"Inositol lipid 3-phosphatase PTEN converts Ptdlns(3,4)P 2 into phosphatidylinositol 4-phosphate.",3.1535955829995146,1.0,1.0,1.0,1.0,1.0,1.0,1.0,1.0,1.0,1.0,1.0,1.0,1.0,1.0,1.0,1.0
SciFact,BM25 + BGE-Reranker,637,Input from  mental and physical health care professionals is effective at decreasing homelessness.,3.0890037839999422,0.5,0.3333333333333333,1.0,0.3333333333333333,0.5,0.3333333333333333,1.0,0.3333333333333333,0.5,0.3333333333333333,1.0,0.3333333333333333,0.5,0.3333333333333333,1.0,0.3333333333333333
SciFact,BM25 + BGE-Reranker,641,Insomnia can be effectively treated with cognitive behavioral therapy.,3.1933068500002264,0.8772153153380493,1.0,1.0,0.75,0.8772153153380493,1.0,1.0,0.75,0.8772153153380493,1.0,1.0,0.75,0.8772153153380493,1.0,1.0,0.75
SciFact,BM25 + BGE-Reranker,644,Insulin increases risk of severe kidney failure.,3.065197861999877,1.0,1.0,1.0,1.0,1.0,1.0,1.0,1.0,1.0,1.0,1.0,1.0,1.0,1.0,1.0,1.0
SciFact,BM25 + BGE-Reranker,649,Integrating classroom-based collaborative learning with Web-based collaborative learning leads to subpar class performance,3.0627745000001596,0.6309297535714575,0.5,1.0,0.5,0.6309297535714575,0.5,1.0,0.5,0.6309297535714575,0.5,1.0,0.5,0.6309297535714575,0.5,1.0,0.5
SciFact,BM25 + BGE-Reranker,659,Ivermectin is used to treat lymphatic filariasis.,2.9999107979992914,1.0,1.0,1.0,1.0,1.0,1.0,1.0,1.0,1.0,1.0,1.0,1.0,1.0,1.0,1.0,1.0
SciFact,BM25 + BGE-Reranker,660,Ivermectin is used to treat onchocerciasis.,3.017737259000569,1.0,1.0,1.0,1.0,1.0,1.0,1.0,1.0,1.0,1.0,1.0,1.0,1.0,1.0,1.0,1.0
SciFact,BM25 + BGE-Reranker,674,LDL cholesterol has no involvement in the development of cardiovascular disease.,3.1782815939996,1.0,1.0,1.0,1.0,1.0,1.0,1.0,1.0,1.0,1.0,1.0,1.0,1.0,1.0,1.0,1.0
SciFact,BM25 + BGE-Reranker,684,Lack of clpC does not affect sporulation efficiency in Bacillus subtilis cells.,3.035427122999863,1.0,1.0,1.0,1.0,1.0,1.0,1.0,1.0,1.0,1.0,1.0,1.0,1.0,1.0,1.0,1.0
SciFact,BM25 + BGE-Reranker,690,Less than 10% of the gabonese children with Schimmelpenning-Feuerstein-Mims syndrome (SFM) had a plasma lactate of more than 5mmol/L.,3.134693119000076,0.5,0.3333333333333333,1.0,0.3333333333333333,0.5,0.3333333333333333,1.0,0.3333333333333333,0.5,0.3333333333333333,1.0,0.3333333333333333,0.5,0.3333333333333333,1.0,0.3333333333333333
SciFact,BM25 + BGE-Reranker,691,Leukemia associated Rho guanine nucleotide-exchange factor represses RhoA in response to SRC activation.,3.037651993000509,1.0,1.0,1.0,1.0,1.0,1.0,1.0,1.0,1.0,1.0,1.0,1.0,1.0,1.0,1.0,1.0
SciFact,BM25 + BGE-Reranker,692,Leuko-increased blood increases infectious complications in red blood cell transfusion.,3.1365971049999644,1.0,1.0,1.0,1.0,1.0,1.0,1.0,1.0,1.0,1.0,1.0,1.0,1.0,1.0,1.0,1.0
SciFact,BM25 + BGE-Reranker,693,Leuko-reduced blood reduces infectious complications in red blood cell transfusion.,3.0584964199997557,1.0,1.0,1.0,1.0,1.0,1.0,1.0,1.0,1.0,1.0,1.0,1.0,1.0,1.0,1.0,1.0
SciFact,BM25 + BGE-Reranker,700,Localization of PIN1 in the Arabidopsis embryo does not require VPS9a,3.0099249320001036,0.6309297535714575,0.5,1.0,0.5,0.6309297535714575,0.5,1.0,0.5,0.6309297535714575,0.5,1.0,0.5,0.6309297535714575,0.5,1.0,0.5
SciFact,BM25 + BGE-Reranker,702,Localization of PIN1 in the roots of Arabidopsis does not require VPS9a,2.9671207339997636,0.6309297535714575,0.5,1.0,0.5,0.6309297535714575,0.5,1.0,0.5,0.6309297535714575,0.5,1.0,0.5,0.6309297535714575,0.5,1.0,0.5
SciFact,BM25 + BGE-Reranker,715,Low expression of miR7a does represses target genes and exerts a biological function in ovaries.,3.1077474749999965,0.0,0.0,0.0,0.0,0.0,0.0,0.0,0.0,0.0,0.0,0.0,0.0,0.0,0.0,0.0,0.0
SciFact,BM25 + BGE-Reranker,716,Low expression of miR7a exerts a biological function in testis.,3.0030319520001285,0.0,0.0,0.0,0.0,0.0,0.0,0.0,0.0,0.0,0.0,0.0,0.0,0.0,0.0,0.0,0.0
SciFact,BM25 + BGE-Reranker,718,Low nucleosome occupancy correlates with low methylation levels across species.,3.0468301800001427,1.0,1.0,1.0,1.0,1.0,1.0,1.0,1.0,1.0,1.0,1.0,1.0,1.0,1.0,1.0,1.0
SciFact,BM25 + BGE-Reranker,721,Lupus-prone mice infected with curliproducing bacteria have higher autoantibody titers compared to controls.,3.0533299449998594,1.0,1.0,1.0,1.0,1.0,1.0,1.0,1.0,1.0,1.0,1.0,1.0,1.0,1.0,1.0,1.0
SciFact,BM25 + BGE-Reranker,723,Ly49Q directs the organization of neutrophil migration to inflammation sites by regulating membrane raft functions.,3.010435901999699,1.0,1.0,1.0,1.0,1.0,1.0,1.0,1.0,1.0,1.0,1.0,1.0,1.0,1.0,1.0,1.0
SciFact,BM25 + BGE-Reranker,727,Ly6C hi monocytes have a lower inflammatory capacity compared to their Ly6C lo counterparts.,3.180534398999953,0.38685280723454163,0.2,1.0,0.2,0.38685280723454163,0.2,1.0,0.2,0.38685280723454163,0.2,1.0,0.2,0.38685280723454163,0.2,1.0,0.2
SciFact,BM25 + BGE-Reranker,728,Ly6C hi monocytes have a lower inflammatory capacity than Ly6C lo monocytes.,3.0551811959994666,0.8772153153380493,1.0,1.0,0.75,0.8772153153380493,1.0,1.0,0.75,0.8772153153380493,1.0,1.0,0.75,0.8772153153380493,1.0,1.0,0.75
SciFact,BM25 + BGE-Reranker,729,Lymphadenopathy is observed in knockin mouse lacking the SHP-2 MAPK pathway.,3.0433821630003877,1.0,1.0,1.0,1.0,1.0,1.0,1.0,1.0,1.0,1.0,1.0,1.0,1.0,1.0,1.0,1.0
SciFact,BM25 + BGE-Reranker,742,Macrolides have no protective effect against myocardial infarction.,3.084228067999902,1.0,1.0,1.0,1.0,1.0,1.0,1.0,1.0,1.0,1.0,1.0,1.0,1.0,1.0,1.0,1.0
SciFact,BM25 + BGE-Reranker,743,Macrolides protect against myocardial infarction.,3.1344806130000507,1.0,1.0,1.0,1.0,1.0,1.0,1.0,1.0,1.0,1.0,1.0,1.0,1.0,1.0,1.0,1.0
SciFact,BM25 + BGE-Reranker,744,Macropinocytosis contributes to a cell's supply of amino acids via the intracellular uptake of protein.,3.0896331430003556,0.6309297535714575,0.5,1.0,0.5,0.6309297535714575,0.5,1.0,0.5,0.6309297535714575,0.5,1.0,0.5,0.6309297535714575,0.5,1.0,0.5
SciFact,BM25 + BGE-Reranker,756,Many proteins in human cells can be post-translationally modified at lysine residues via acetylation.,3.039592735000042,0.5,0.3333333333333333,1.0,0.3333333333333333,0.5,0.3333333333333333,1.0,0.3333333333333333,0.5,0.3333333333333333,1.0,0.3333333333333333,0.5,0.3333333333333333,1.0,0.3333333333333333
SciFact,BM25 + BGE-Reranker,759,Mathematical models predict that using Artemisinin-based combination therapy over nongametocytocidal drugs have a dramatic impact in reducing malaria transmission.,3.0547957889993995,1.0,1.0,1.0,1.0,1.0,1.0,1.0,1.0,1.0,1.0,1.0,1.0,1.0,1.0,1.0,1.0
SciFact,BM25 + BGE-Reranker,768,Mercaptopurine is anabolized into the inactive methylmercaptopurine by thiopurine methyltrasnferase (TPMT).,3.0671046199995544,0.43067655807339306,0.25,1.0,0.25,0.43067655807339306,0.25,1.0,0.25,0.43067655807339306,0.25,1.0,0.25,0.43067655807339306,0.25,1.0,0.25
SciFact,BM25 + BGE-Reranker,770,Metastatic colorectal cancer treated with a single agent fluoropyrimidines resulted in reduced efficacy and lower quality of life when compared with oxaliplatin-based chemotherapy in elderly patients.,3.268207516000075,1.0,1.0,1.0,1.0,1.0,1.0,1.0,1.0,1.0,1.0,1.0,1.0,1.0,1.0,1.0,1.0
SciFact,BM25 + BGE-Reranker,775,Mice defective for deoxyribonucleic acid (DNA) polymerase I (polI) reveal increased sensitivity to ionizing radiation (IR).,3.0539966400001504,0.0,0.0,0.0,0.0,0.0,0.0,0.0,0.0,0.0,0.0,0.0,0.0,0.0,0.0,0.0,0.0
SciFact,BM25 + BGE-Reranker,781,Mice that lack Interferon-γ or its receptor exhibit high resistance to experimental autoimmune myocarditis.,3.0290887929995733,0.6309297535714575,0.5,1.0,0.5,0.6309297535714575,0.5,1.0,0.5,0.6309297535714575,0.5,1.0,0.5,0.6309297535714575,0.5,1.0,0.5
SciFact,BM25 + BGE-Reranker,783,Mice without IFN-γ or its receptor are resistant to EAM induced with α-MyHC/CFA.,3.079428490000282,0.0,0.0,0.0,0.0,0.0,0.0,0.0,0.0,0.0,0.0,0.0,0.0,0.0,0.0,0.0,0.0
SciFact,BM25 + BGE-Reranker,784,MicroRNA is involved in the regulation of Neural Stem Cell (NSC) differentiation and proliferation dynamic homeostasis,3.0866635410002345,1.0,1.0,1.0,1.0,1.0,1.0,1.0,1.0,1.0,1.0,1.0,1.0,1.0,1.0,1.0,1.0
SciFact,BM25 + BGE-Reranker,785,Microarray results from culture-amplified mixtures of serotypes correlate poorly with microarray results from uncultured mixtures.,3.083471861000362,0.6309297535714575,0.5,1.0,0.5,0.6309297535714575,0.5,1.0,0.5,0.6309297535714575,0.5,1.0,0.5,0.6309297535714575,0.5,1.0,0.5
SciFact,BM25 + BGE-Reranker,793,Mitochondria are uninvolved in apoptosis.,2.979563535000125,1.0,1.0,1.0,1.0,1.0,1.0,1.0,1.0,1.0,1.0,1.0,1.0,1.0,1.0,1.0,1.0
SciFact,BM25 + BGE-Reranker,800,Modifying the epigenome in the brain affects the normal human aging process by affecting certain genes related to neurogenesis.,3.0307768610000494,0.0,0.0,0.0,0.0,0.0,0.0,0.0,0.0,0.0,0.0,0.0,0.0,0.0,0.0,0.0,0.0
SciFact,BM25 + BGE-Reranker,805,Monoclonal antibody targeting of N-cadherin inhibits metastasis.,3.0531799210002646,1.0,1.0,1.0,1.0,1.0,1.0,1.0,1.0,1.0,1.0,1.0,1.0,1.0,1.0,1.0,1.0
SciFact,BM25 + BGE-Reranker,808,Most termination events in Okazaki fragments are sequence specific.,3.031003887999759,1.0,1.0,1.0,1.0,1.0,1.0,1.0,1.0,1.0,1.0,1.0,1.0,1.0,1.0,1.0,1.0
SciFact,BM25 + BGE-Reranker,811,Mutant mice lacking SVCT2 have greatly increased ascorbic acid levels in both brain and adrenals.,3.0574191160003465,1.0,1.0,1.0,1.0,1.0,1.0,1.0,1.0,1.0,1.0,1.0,1.0,1.0,1.0,1.0,1.0
SciFact,BM25 + BGE-Reranker,814,"Mutations in G-Beta protein GNB2 are present in many cancers, resulting in loss of interaction with G-alpha subunits and concomitant activation of AKT pathway.",3.084072056999503,1.0,1.0,1.0,1.0,1.0,1.0,1.0,1.0,1.0,1.0,1.0,1.0,1.0,1.0,1.0,1.0
SciFact,BM25 + BGE-Reranker,820,N-terminal cleavage increases success identifying transcription start sites.,3.0013247399992906,0.0,0.0,0.0,0.0,0.0,0.0,0.0,0.0,0.23540891336663824,0.05555555555555555,1.0,0.05555555555555555,0.0,0.0,0.0,0.0
SciFact,BM25 + BGE-Reranker,821,N-terminal cleavage reduces success identifying transcription start sites.,3.098914889000298,0.0,0.0,0.0,0.0,0.0,0.0,0.0,0.0,0.23540891336663824,0.05555555555555555,1.0,0.05555555555555555,0.0,0.0,0.0,0.0
SciFact,BM25 + BGE-Reranker,823,N348I mutations cause resistance to zidovudine (AZT).,3.0111700590005057,1.0,1.0,1.0,1.0,1.0,1.0,1.0,1.0,1.0,1.0,1.0,1.0,1.0,1.0,1.0,1.0
SciFact,BM25 + BGE-Reranker,830,NF2 (Merlin) causes phosphorylation and subsequent cytoplasmic sequestration of YAP in Drosophila by activating LATS1/2 kinases.,3.080878594999376,0.0,0.0,0.0,0.0,0.0,0.0,0.0,0.0,0.0,0.0,0.0,0.0,0.0,0.0,0.0,0.0
SciFact,BM25 + BGE-Reranker,831,NF2 (Merlin) prevents phosphorylation and subsequent cytoplasmic sequestration of YAP in Drosophila.,3.030790447000072,0.0,0.0,0.0,0.0,0.0,0.0,0.0,0.0,0.0,0.0,0.0,0.0,0.0,0.0,0.0,0.0
SciFact,BM25 + BGE-Reranker,832,NFAT4 activation requires IP3R-mediated Ca2+ mobilization.,3.0839336320004804,1.0,1.0,1.0,1.0,1.0,1.0,1.0,1.0,1.0,1.0,1.0,1.0,1.0,1.0,1.0,1.0
SciFact,BM25 + BGE-Reranker,834,NOX2-independent pathways can generate peroxynitrite by reacting with nitrogen intermediates.,3.047900980000122,0.5,0.3333333333333333,1.0,0.3333333333333333,0.5,0.3333333333333333,1.0,0.3333333333333333,0.5,0.3333333333333333,1.0,0.3333333333333333,0.5,0.3333333333333333,1.0,0.3333333333333333
SciFact,BM25 + BGE-Reranker,837,NR5A2 is important in development of endometrial tissues.,3.0236912660002417,1.0,1.0,1.0,1.0,1.0,1.0,1.0,1.0,1.0,1.0,1.0,1.0,1.0,1.0,1.0,1.0
SciFact,BM25 + BGE-Reranker,839,Nanoparticles can be targeted against specific cell types by incorporating aptamers into lipid nanoparticles.,3.0336590249999063,1.0,1.0,1.0,1.0,1.0,1.0,1.0,1.0,1.0,1.0,1.0,1.0,1.0,1.0,1.0,1.0
SciFact,BM25 + BGE-Reranker,845,Neutrophil extracellular traps (NETs) are released by ANCA-stimulated neutrophils.,3.047235513000487,1.0,1.0,1.0,1.0,1.0,1.0,1.0,1.0,1.0,1.0,1.0,1.0,1.0,1.0,1.0,1.0
SciFact,BM25 + BGE-Reranker,847,New drugs for tuberculosis often do not penetrate the necrotic portion of a tuberculosis lesion in high concentrations.,3.207842098000583,1.0,1.0,1.0,1.0,1.0,1.0,1.0,1.0,1.0,1.0,1.0,1.0,1.0,1.0,1.0,1.0
SciFact,BM25 + BGE-Reranker,852,Non-invasive ventilation use should be decreased if there is inadequate response to conventional treatment.,3.1039514429994597,1.0,1.0,1.0,1.0,1.0,1.0,1.0,1.0,1.0,1.0,1.0,1.0,1.0,1.0,1.0,1.0
SciFact,BM25 + BGE-Reranker,859,Normal expression of RUNX1 has tumor-promoting effects.,3.033668983000098,0.0,0.0,0.0,0.0,0.3333333333333333,0.14285714285714285,1.0,0.14285714285714285,0.3333333333333333,0.14285714285714285,1.0,0.14285714285714285,0.3333333333333333,0.14285714285714285,1.0,0.14285714285714285
SciFact,BM25 + BGE-Reranker,870,Obesity decreases life quality.,3.0438443670000197,0.0,0.0,0.0,0.0,0.0,0.0,0.0,0.0,0.0,0.0,0.0,0.0,0.0,0.0,0.0,0.0
SciFact,BM25 + BGE-Reranker,873,Obesity is determined solely by environmental factors.,3.0869538870001634,0.0,0.0,0.0,0.0,0.10699313236726378,0.125,0.2,0.025,0.10699313236726378,0.125,0.2,0.025,0.10699313236726378,0.125,0.2,0.025
SciFact,BM25 + BGE-Reranker,879,Occupancy of ribosomes by IncRNAs do not make functional peptides.,3.0677625379994424,1.0,1.0,1.0,1.0,1.0,1.0,1.0,1.0,1.0,1.0,1.0,1.0,1.0,1.0,1.0,1.0
SciFact,BM25 + BGE-Reranker,880,Occupancy of ribosomes by IncRNAs mirror 5 0-UTRs,3.092366545999539,1.0,1.0,1.0,1.0,1.0,1.0,1.0,1.0,1.0,1.0,1.0,1.0,1.0,1.0,1.0,1.0
SciFact,BM25 + BGE-Reranker,882,Omnivores produce less trimethylamine N-oxide from dietary I-carnitine than vegetarians.,3.078734642999734,1.0,1.0,1.0,1.0,1.0,1.0,1.0,1.0,1.0,1.0,1.0,1.0,1.0,1.0,1.0,1.0
SciFact,BM25 + BGE-Reranker,887,Only a minority of cells survive development after differentiation into stress-resistant spores.,3.0637756999994963,0.0,0.0,0.0,0.0,0.0,0.0,0.0,0.0,0.0,0.0,0.0,0.0,0.0,0.0,0.0,0.0
SciFact,BM25 + BGE-Reranker,903,PD-1 triggering on monocytes reduces IL-10 production by monocytes.,3.136437087999184,1.0,1.0,1.0,1.0,1.0,1.0,1.0,1.0,1.0,1.0,1.0,1.0,1.0,1.0,1.0,1.0
SciFact,BM25 + BGE-Reranker,904,PDPN promotes efficient motility along stromal surfaces by activating the C-type lectin receptor to rearrange the actin cytoskeleton in dendritic cells.,3.0736068980004347,1.0,1.0,1.0,1.0,1.0,1.0,1.0,1.0,1.0,1.0,1.0,1.0,1.0,1.0,1.0,1.0
SciFact,BM25 + BGE-Reranker,907,PGE 2 promotes intestinal tumor growth by altering the expression of tumor suppressing and DNA repair genes.,3.0622173269994164,1.0,1.0,1.0,1.0,1.0,1.0,1.0,1.0,1.0,1.0,1.0,1.0,1.0,1.0,1.0,1.0
SciFact,BM25 + BGE-Reranker,911,PKG-la plays an essential role in expression of pain hypersensitivity in PGK-la knockout mice.,3.054707545999918,1.0,1.0,1.0,1.0,1.0,1.0,1.0,1.0,1.0,1.0,1.0,1.0,1.0,1.0,1.0,1.0
SciFact,BM25 + BGE-Reranker,913,PPAR-RXRs are inhibited by PPAR ligands.,3.087993369999822,0.0,0.0,0.0,0.0,0.0,0.0,0.0,0.0,0.0,0.0,0.0,0.0,0.0,0.0,0.0,0.0
SciFact,BM25 + BGE-Reranker,914,PPAR-RXRs can be activated by PPAR ligands.,3.039146313999481,0.0,0.0,0.0,0.0,0.0,0.0,0.0,0.0,0.0,0.0,0.0,0.0,0.0,0.0,0.0,0.0
SciFact,BM25 + BGE-Reranker,921,Participating in six months of physical activity improves cognitive functioning.,3.0559781849997307,1.0,1.0,1.0,1.0,1.0,1.0,1.0,1.0,1.0,1.0,1.0,1.0,1.0,1.0,1.0,1.0
SciFact,BM25 + BGE-Reranker,922,Patients in stable partnerships have a faster progression from HIV to AIDS.,3.0700338329997976,1.0,1.0,1.0,1.0,1.0,1.0,1.0,1.0,1.0,1.0,1.0,1.0,1.0,1.0,1.0,1.0
SciFact,BM25 + BGE-Reranker,936,Peroxynitrite is required for nitration of TCR/CD8.,2.946999163000328,1.0,1.0,1.0,1.0,1.0,1.0,1.0,1.0,1.0,1.0,1.0,1.0,1.0,1.0,1.0,1.0
SciFact,BM25 + BGE-Reranker,956,Pleiotropic coupling of GLP-1R to intracellular effectors promotes distinct profiles of cellular signaling.,3.112651726999502,0.5,0.3333333333333333,1.0,0.3333333333333333,0.5,0.3333333333333333,1.0,0.3333333333333333,0.5,0.3333333333333333,1.0,0.3333333333333333,0.5,0.3333333333333333,1.0,0.3333333333333333
SciFact,BM25 + BGE-Reranker,957,Podocytes are motile and migrate in the presence of injury.,3.0070229000002655,1.0,1.0,1.0,1.0,1.0,1.0,1.0,1.0,1.0,1.0,1.0,1.0,1.0,1.0,1.0,1.0
SciFact,BM25 + BGE-Reranker,960,Polymeal nutrition reduces cardiovascular mortality.,3.0772118530003354,1.0,1.0,1.0,1.0,1.0,1.0,1.0,1.0,1.0,1.0,1.0,1.0,1.0,1.0,1.0,1.0
SciFact,BM25 + BGE-Reranker,967,Pretreatment with the Arp2/3 inhibitor CK-666 affects lamelliopodia formation.,3.065185794000172,0.9197207891481876,1.0,1.0,0.8333333333333333,0.9197207891481876,1.0,1.0,0.8333333333333333,0.9197207891481876,1.0,1.0,0.8333333333333333,0.9197207891481876,1.0,1.0,0.8333333333333333
SciFact,BM25 + BGE-Reranker,971,Primary cervical cancer screening with HPV detection has higher longitudinal sensitivity than conventional cytology to detect cervical intraepithelial neoplasia grade 2.,3.23198844900071,0.7095272044910244,1.0,0.75,0.525,0.8396538878217249,1.0,1.0,0.6678571428571429,0.8396538878217249,1.0,1.0,0.6678571428571429,0.8396538878217249,1.0,1.0,0.6678571428571429
SciFact,BM25 + BGE-Reranker,975,Primary pro-inflammatory cytokines induce secondary pro- and anti-inflammatory mediators.,3.0969551019998107,0.0,0.0,0.0,0.0,0.0,0.0,0.0,0.0,0.0,0.0,0.0,0.0,0.0,0.0,0.0,0.0
SciFact,BM25 + BGE-Reranker,982,Proteins synthesized at the growth cone are ubiquitinated at a higher rate than proteins from the cell body.,3.0605637219996424,1.0,1.0,1.0,1.0,1.0,1.0,1.0,1.0,1.0,1.0,1.0,1.0,1.0,1.0,1.0,1.0
SciFact,BM25 + BGE-Reranker,985,Pseudogene PTENP1 regulates the expression of PTEN by functioning as an miRNA decoy.,3.0532837890004885,1.0,1.0,1.0,1.0,1.0,1.0,1.0,1.0,1.0,1.0,1.0,1.0,1.0,1.0,1.0,1.0
SciFact,BM25 + BGE-Reranker,993,Pyridostatin destabilizes the G - quadruplex in the telomeric region.,3.0602812930001164,1.0,1.0,1.0,1.0,1.0,1.0,1.0,1.0,1.0,1.0,1.0,1.0,1.0,1.0,1.0,1.0
SciFact,BM25 + BGE-Reranker,1012,Radioiodine treatment of non-toxic multinodular goitre reduces thyroid volume.,3.158827146000476,1.0,1.0,1.0,1.0,1.0,1.0,1.0,1.0,1.0,1.0,1.0,1.0,1.0,1.0,1.0,1.0
SciFact,BM25 + BGE-Reranker,1014,Rapamycin decreases the concentration of triacylglycerols in fruit flies.,3.047556068000631,1.0,1.0,1.0,1.0,1.0,1.0,1.0,1.0,1.0,1.0,1.0,1.0,1.0,1.0,1.0,1.0
SciFact,BM25 + BGE-Reranker,1019,Rapid phosphotransfer rates govern fidelity in two component systems,2.935465392999504,0.6309297535714575,0.5,1.0,0.5,0.6309297535714575,0.5,1.0,0.5,0.6309297535714575,0.5,1.0,0.5,0.6309297535714575,0.5,1.0,0.5
SciFact,BM25 + BGE-Reranker,1020,Rapid up-regulation and higher basal expression of interferon-induced genes increase survival of granule cell neurons that are infected by West Nile virus.,3.0957403180000256,0.6309297535714575,0.5,1.0,0.5,0.6309297535714575,0.5,1.0,0.5,0.6309297535714575,0.5,1.0,0.5,0.6309297535714575,0.5,1.0,0.5
SciFact,BM25 + BGE-Reranker,1021,Rapid up-regulation and higher basal expression of interferon-induced genes reduce survival of granule cell neurons that are infected by West Nile virus.,3.202424062999853,0.6309297535714575,0.5,1.0,0.5,0.6309297535714575,0.5,1.0,0.5,0.6309297535714575,0.5,1.0,0.5,0.6309297535714575,0.5,1.0,0.5
SciFact,BM25 + BGE-Reranker,1024,Recurrent mutations occur frequently within CTCF anchor sites adjacent to oncogenes.,3.0266374069997255,1.0,1.0,1.0,1.0,1.0,1.0,1.0,1.0,1.0,1.0,1.0,1.0,1.0,1.0,1.0,1.0
SciFact,BM25 + BGE-Reranker,1029,Reduced responsiveness to interleukin-2 in regulatory T cells is associated with greater resistance to autoimmune diseases such as Type 1 Diabetes.,3.090874829999848,0.7653606369886217,1.0,0.6666666666666666,0.6666666666666666,0.7653606369886217,1.0,0.6666666666666666,0.6666666666666666,0.8801699317146395,1.0,1.0,0.7291666666666666,0.7653606369886217,1.0,0.6666666666666666,0.6666666666666666
